Discipline,Titel,Beschrijving,Publicatiedatum,Publicatietijd
politie,2 ongeval wegvervoer materieel john mottweg rotterdam icnum 588077,Politie naar John Mottweg in Rotterdam voor Ongeval Wegvervoer Materieel,2023-11-01,17:53:57
brandweer,p 2 bdh-04 liftopsluiting jan pietersz. coenstraat 's-gravenhage 157230,Assistentie bij liftopsluiting op Jan Pietersz. Coenstraat in Den Haag,2023-11-01,18:20:45
brandweer,p 1 stank/hind. lucht gaslucht p.j. oudstraat papendrecht,Gaslucht op P.J. Oudstraat in Papendrecht,2023-11-01,18:17:11
brandweer,p 1 brt-02 stank/hind. lucht gaslucht p.j. oudstraat papendrecht 186932,Gaslucht op P.J. Oudstraat in Papendrecht,2023-11-01,18:17:11
brandweer,p 1 bnn-01 dienstverlening tco-b westdorperstraat borger,Geen beschrijving beschikbaar,2023-11-01,18:16:22
brandweer,proefalarm avond brandweer veiligheidsregio rotterdam rijnmond.,Proefalarm in Rotterdam,2023-11-01,18:15:56
politie,"aanrijding letsel a73 li 99,6 nijmegen 687881",Politie naar A73 in Nijmegen voor ongeval met letsel,2023-11-01,18:24:12
politie,"aanrijding letsel a73 li 99,6 nijmegen 687854",Politie naar A73 in Nijmegen voor ongeval met letsel,2023-11-01,18:23:39
politie,aanrijding letsel sint urbanusweg venlo,Politie naar Sint Urbanusweg in Venlo voor ongeval met letsel,2023-11-01,18:17:01
politie,prio 1 lansinghageweg zoetmr ongeval wegvervoer letsel,Ongeval met letsel op Lansinghageweg in Zoetermeer,2023-11-01,18:12:12
brandweer,p 2 bdh-03 wateroverlast binnen castellumweg leiden 164230,Wateroverlast op Castellumweg in Leiden,2023-11-01,18:31:14
brandweer,p 5 proefalarm p2000 geplande actie gmk amsterdam elandsgracht amsterdam,Brandweer met spoed naar Elandsgracht in Amsterdam,2023-11-01,18:30:17
brandweer,p 1 400833 schip/watersp. in problemen veerweg dussen,Waterongeval op Veerweg in Dussen,2023-11-01,18:29:49
brandweer,p 1 bdh-02 oms brandmelding world fashion appartments gevers deynootweg 's-gravenhage 157130,Automatisch brandalarm op Gevers Deynootweg in Den Haag,2023-11-01,18:26:14
brandweer,p 1 ongeval wegvervoer letsel a9 li - kp holendrecht ouderkerk aan de amstel,Ongeval met letsel op A9,2023-11-01,18:25:21
politie,prio 1 hofzichtlaan sgravh ongeval wegvervoer letsel,Ongeval met letsel op Hofzichtlaan in Den Haag,2023-11-01,18:33:52
politie,1 ongeval wegvervoer letsel hoofdweg capelle aan den ijss icnum 588149,Politie  voor ongeval met letsel,2023-11-01,18:27:41
politie,3 dier in problemen ganzenoord rotterdam icnum 588153,Politie naar Ganzenoord in Rotterdam,2023-11-01,18:27:33
politie,"aanrijding letsel afrit a2 li - abcoude 3 37,0 c abcoude",Politie naar A2 in Abcoude voor ongeval met letsel,2023-11-01,18:25:46
brandweer,"prio 4 a4 re 33,5 leiden ongeval wegvervoer materieel",Brandweer naar A4 in Leiden voor Ongeval Wegvervoer Materieel,2023-11-01,18:46:11
brandweer,p 1 br gezondheidszorg erasmus mc gebouw rg dr. molewaterplein rotterdam,Brandmelding op Dr. Molewaterplein in Rotterdam,2023-11-01,18:41:35
brandweer,p 1 brt-01 oms brandmelding erasmus mc gebouw rg dr. molewaterplein rotterdam 170631,Automatisch brandalarm op Dr. Molewaterplein in Rotterdam,2023-11-01,18:41:35
brandweer,p 1 blb-01 br gebouw dillenburg weert 234431,Gebouwbrand op Dillenburg in Weert,2023-11-01,18:40:31
brandweer,p 1 brt-01 br gezondheidszorg erasmus mc gebouw rg dr. molewaterplein rotterdam 170951 170931 179192,Brandmelding op Dr. Molewaterplein in Rotterdam,2023-11-01,18:40:16
brandweer,p 2 dv brw kruisboog veenendaal 095531,Brandweer met gepaste spoed naar Kruisboog in Veenendaal,2023-11-01,18:39:20
brandweer,graag telefonicht contact rac.,Brandweer  voor contact met meldkamer,2023-11-01,18:36:55
politie,ongeval wegvervoer letsel dorpsstraatca liempde,Politie naar Dorpsstraat in Liempde voor ongeval met letsel,2023-11-01,18:39:18
brandweer,u bent niet langer actief in de functie piket_vrr_algemeen commandant crisiscommunicatie.,Geen beschrijving beschikbaar,2023-11-01,18:55:36
brandweer,u bent nu actief in de functie piket_vrr_algemeen commandant crisiscommunicatie.,Brandweer,2023-11-01,18:55:36
brandweer,p 1 brt-03 ongeval gaslekkage buiten lekdijk langerak 189493 187431,Gaslek op Lekdijk in Langerak,2023-11-01,18:54:44
brandweer,p 1 bnh-02 br bijgebouw middelweg petten 104231 104241,Brand in bijgebouw op Middelweg in Petten,2023-11-01,18:54:00
brandweer,p 1 bnn-02 oms brandmelding serviceflat drachten burgemeester wuiteweg drachten 027031,Automatisch brandalarm op Burgemeester Wuiteweg in Drachten,2023-11-01,18:50:11
brandweer,p 1 bad-01 br woning alfred nobelstraat diemen 133551 134231 133531,Woningbrand op Alfred Nobelstraat in Diemen,2023-11-01,18:48:44
brandweer,p 2 bdh-01 liftopsluiting halte rr de leijens van 't hoffplein zoetermeer 155230,Assistentie bij liftopsluiting op Van 't Hoffplein in Zoetermeer,2023-11-01,18:47:12
politie,bel oc gms 275631,Politie,2023-11-01,18:49:40
politie,graag tel. contact zcc zwolle,Politie naar Zwolle,2023-11-01,18:47:38
politie,piket gaarne contact oc rotterdam,Politie naar Rotterdam,2023-11-01,18:47:35
politie,"prio 1 a4 re 33,5 leiden ongeval wegvervoer letsel",Ongeval met letsel op A4 in Leiden,2023-11-01,18:47:31
trauma,a1 dia: ja ambu 17992 scheldestraat 4381rp vlissingen vlissg bon 153504,Geen beschrijving beschikbaar,2023-11-01,18:55:24
brandweer,p 2 bon-01 liftopsluiting kantoortoren rijntoren k1 nieuwe stationsstraat arnhem 073631,Assistentie bij liftopsluiting op Nieuwe Stationsstraat in Arnhem,2023-11-01,19:19:46
brandweer,p 1 bzb-01 oms handmelder zep podium t/m 35 podium middelburg 194533,Automatisch brandalarm (handmelder) op Podium in Middelburg,2023-11-01,19:17:16
brandweer,p 3 intrekken alarm brw br gerucht stg reinaerde prins hendrikstraat woudenberg,Brandgerucht op Prins Hendrikstraat in Woudenberg,2023-11-01,19:16:59
brandweer,p 2 br gerucht stg reinaerde prins hendrikstraat woudenberg 096434,Brandgerucht op Prins Hendrikstraat in Woudenberg,2023-11-01,19:13:41
brandweer,p 2 ass. ambu afhijsen walstro leusden 090152 092231,Assistentie ambulance voor afhijsen patiënt op Walstro in Leusden,2023-11-01,19:13:31
brandweer,p 2 gaarne telefonisch contact mkb wateroverlast binnen castellumweg leiden,Wateroverlast op Castellumweg in Leiden,2023-11-01,19:10:49
brandweer,p 1 bnh-02 middel br br woning middelweg petten,Woningbrand op Middelweg in Petten,2023-11-01,19:10:45
brandweer,p 1 bdh-04 stank/hind. lucht gaslucht binnen nathaliegang zoetermeer 159650,Gaslucht op Nathaliegang in Zoetermeer,2023-11-01,19:09:14
brandweer,p 1 bdh-04 stank/hind. lucht gaslucht binnen nathaliegang zoetermeer 155230,Gaslucht op Nathaliegang in Zoetermeer,2023-11-01,19:09:14
brandweer,p 2 dv aan derden meting johan van oldenbarneveltstraat leerdam 098391 096831,Brandweer met gepaste spoed naar Johan van Oldenbarneveltstraat in Leerdam,2023-11-01,19:07:46
brandweer,p 1 intrekken alarm brw reanimatie echterstraat maasbracht,Assistentie bij reanimatie op Echterstraat in Maasbracht,2023-11-01,19:05:37
brandweer,p 1 blb-02 reanimatie echterstraat maasbracht 235731,Assistentie bij reanimatie op Echterstraat in Maasbracht,2023-11-01,19:03:08
brandweer,maandelijks proefalarm tco haaglanden,Brandweer met spoed voor Proefalarm,2023-11-01,19:02:37
brandweer,p 1 400869 letsel duinstraat raadhuisstraat duinstraat hoogerheide,Geen beschrijving beschikbaar,2023-11-01,19:01:59
brandweer,p 1 400869 letsel,Brandweer met spoed voor ongeval met letsel,2023-11-01,19:01:59
brandweer,p 1 bdh-02 ongeval buiten vv b.g.c. floreant hoogeveenseweg boskoop 162234,Ongeval op Hoogeveenseweg in Boskoop,2023-11-01,19:00:42
brandweer,"prio 4 a12 re 36,3 bodegr verdacht voer-/vaartuig",Brandweer naar A12 in Bodegraven,2023-11-01,19:00:07
brandweer,graag hefbrug boskoop vrij houden,Brandweer naar Boskoop,2023-11-01,18:59:35
politie,prio 1 n466 - middel broekweg honsdk ongeval wegvervoer letsel,Ongeval met letsel op N466,2023-11-01,19:21:14
politie,aanrijding letsel vuurscheschans nieuwegein,Politie naar Vuurscheschans in Nieuwegein voor ongeval met letsel,2023-11-01,19:12:59
politie,"aanrijding letsel n831 14,7 velddriel 687970",Politie naar N831 in Velddriel voor ongeval met letsel,2023-11-01,19:10:40
politie,duinstraat raadhuisstraat duinstraat hoogerheide,Geen beschrijving beschikbaar,2023-11-01,19:01:59
trauma,a1 dia mmt 13991 marelstraat maassluis 98291,Traumaheli naar Marelstraat in Maassluis,2023-11-01,19:15:20
brandweer,p 1 bnh-20 lvo voorzorg baan 18r spl ugs-c polderbaan schiphol 121221 129230 129291,Brandweer met spoed,2023-11-01,19:29:05
brandweer,p 1 400903 letsel kraaivenstraat tilburg,Ongeval met letsel op Kraaivenstraat in Tilburg,2023-11-01,19:28:51
brandweer,p 2 bon-02 dier in put/kelder larenseweg markelo 051641 051679 055241,Brandweer met gepaste spoed naar Larenseweg in Markelo,2023-11-01,19:26:07
brandweer,p 2 dv aan derden openhof kerk veenbesstraat soest 093431,Brandweer met gepaste spoed naar Veenbesstraat in Soest,2023-11-01,19:25:07
brandweer,p 1 bdh-01 ongeval wegvervoer lichte thv n466 - middel broekweg honselersdijk 157770 159591 156831,Ongeval op Middel Broekweg in Honselersdijk,2023-11-01,19:23:02
brandweer,u bent niet langer actief in de functie piket_brw_tl-tdv_dienst actief.,Brandweer,2023-11-01,19:21:56
brandweer,u bent nu actief in de functie piket_brw_tl-tdv_dienst actief.,Brandweer,2023-11-01,19:21:56
politie,1 ongeval wegvervoer materieel nieuwe binnenweg rotterdam icnum 588241,Politie naar Nieuwe Binnenweg in Rotterdam voor Ongeval Wegvervoer Materieel,2023-11-01,19:32:24
politie,ongeval wegvervoer letsel irenestraat bisschop van mierlostraat mierlo,Politie naar Irenestraat in Mierlo voor ongeval met letsel,2023-11-01,19:29:31
politie,gaarne contact cellen complex borne 688011,Politie naar Borne,2023-11-01,19:27:27
politie,bel oc gms 275666,Politie,2023-11-01,19:27:25
politie,2 overval woning zuiddijk hellevoetsluis icnum 588233,Politie naar Zuiddijk in Hellevoetsluis  overval,2023-11-01,19:26:59
brandweer,p 2 bnh-01 stank/hind. lucht buiten ekamastraat haarlem 123130,Brandweer met gepaste spoed naar Ekamastraat in Haarlem,2023-11-01,19:35:05
brandweer,graag hefbrug waddinxveen vrij houden,Brandweer naar Waddinxveen,2023-11-01,19:49:37
brandweer,graag hefbrug boskoop vrij houden,Brandweer naar Boskoop,2023-11-01,19:48:57
brandweer,p 1 bdh-02 br woning schoorsteen c. huygenslaan waddinxveen 163152 169194 162260 163830 163131,Woningbrand op C. Huygenslaan in Waddinxveen,2023-11-01,19:48:37
politie,aanrijding letsel lidl amsterdamseweg arnhem 688054,Politie naar Amsterdamseweg in Arnhem voor ongeval met letsel,2023-11-01,19:51:52
politie,ongeval/wegvervoer/letsel prio 1 coevorden krimweg,Ongeval met letsel op Krimweg in Coevorden,2023-11-01,19:46:16
brandweer,p 2 blb-02 br buiten beatrixlaan susteren 235431,Buitenbrand op Beatrixlaan in Susteren,2023-11-01,20:10:35
brandweer,p 2 bzb-02 geplande actie adrzg helihaven ziekenhuis 's-gravenpolderseweg goes 194734,Brandweer met gepaste spoed naar 's-Gravenpolderseweg in Goes,2023-11-01,20:10:11
brandweer,p 1 bdh-02 middel br br woning schoorsteen c. huygenslaan waddinxveen,Woningbrand op C. Huygenslaan in Waddinxveen,2023-11-01,20:05:57
brandweer,p 1 bdh-05 stank/hind. lucht gaslucht binnen poelgeeststraat leiden 169192 164130,Gaslucht op Poelgeeststraat in Leiden,2023-11-01,19:58:46
politie,bel oc 275552,Politie,2023-11-01,20:06:43
politie,piket gaarne contact oc rotterdam,Politie naar Rotterdam,2023-11-01,20:02:55
politie,"ongeval/wegvervoer/letsel prio 1 meeden n33 li 39,1",Ongeval met letsel in Meeden,2023-11-01,20:01:39
politie,ongeval/wegvervoer/letsel prio 2 meeden afrit n33 li - veendam-noord 39,Ongeval met letsel in Meeden,2023-11-01,20:01:24
brandweer,p 2 herbezet./kazerneren herbezetting kazerne gouda keerkring gouda,Brandweer met gepaste spoed naar Keerkring in Gouda  herbezetting kazerne,2023-11-01,20:20:35
brandweer,p 2 bnn-01 dier op hoogte de kapper grote markt groningen 011850,Brandweer met gepaste spoed naar Grote Markt in Groningen,2023-11-01,20:13:57
brandweer,p 1 400961 letsel renkumlaan tilburg,Ongeval met letsel op Renkumlaan in Tilburg,2023-11-01,20:11:09
politie,u bent nu actief in de functie communicatie politie piket actief.,Politie,2023-11-01,20:11:37
brandweer,p 2 bmd-01 dier in problemen john daltonstraat almere 254133,Dier in problemen op John Daltonstraat in Almere,2023-11-01,20:26:26
brandweer,p 2 bdh-01 brandgerucht vlietzicht bakkershof wateringen 156831,Brandgerucht op Bakkershof in Wateringen,2023-11-01,20:25:10
politie,bel oc 275634,Politie,2023-11-01,20:31:16
politie,graag contact oc apeldoorn politie gms031,Politie naar Apeldoorn,2023-11-01,20:26:55
brandweer,p 2 bdh-03 liftopsluiting stieltjesweg delft 155530,Assistentie bij liftopsluiting op Stieltjesweg in Delft,2023-11-01,20:39:35
brandweer,p 2 bad-01 stank/hind. lucht gaslucht buiten van limburg stirumstraat amsterdam 132431,Gaslucht op Van Limburg Stirumstraat in Amsterdam,2023-11-01,20:34:46
politie,graag contact oc apeldoorn politie 143,Geen beschrijving beschikbaar,2023-11-01,20:41:37
brandweer,vervallen! p 1 reanimatie brede hilledijk rotterdam,Assistentie bij reanimatie op Brede Hilledijk in Rotterdam,2023-11-01,20:50:57
brandweer,p 1 brt-01 reanimatie brede hilledijk rotterdam 173431,Assistentie bij reanimatie op Brede Hilledijk in Rotterdam,2023-11-01,20:49:58
brandweer,p 1 bon-03 br buiten r.a. de monchystraat hengelo 051131,Buitenbrand op R.A. de Monchystraat in Hengelo,2023-11-01,20:47:45
brandweer,p 2 bon-01 br berm-/bosschage achterstraat bennekom 072941,Brandweer met gepaste spoed naar Achterstraat in Bennekom,2023-11-01,20:47:28
politie,"3 dier in problemen n215 li 7,0 stellendam icnum 588365",Geen beschrijving beschikbaar,2023-11-01,20:51:22
trauma,a1 mmt 13991 fien de la marstraat pijnacker 98316,Traumaheli naar Fien de la Marstraat in Pijnacker,2023-11-01,20:42:46
brandweer,p 1 br woning floridaweg capelle aan den ijssel,Woningbrand op Floridaweg in Capelle Aan Den Ijssel,2023-11-01,21:07:25
brandweer,p 1 brt-01 br gebouw floridaweg capelle aan den ijssel 171151 171132 171131,Gebouwbrand op Floridaweg in Capelle Aan Den Ijssel,2023-11-01,21:07:25
brandweer,p 3 brt-02 contact mkb mkb rotterdam wilhelminakade rotterdam 179201,Brandweer zonder spoed naar Wilhelminakade in Rotterdam,2023-11-01,21:05:31
brandweer,"prio 4 a12 r - utrechtsebaan 2,6 sgravh bijzondere verkeerszaken",Brandweer naar A12 in Den Haag,2023-11-01,21:05:10
politie,graag contact oc apeldoorn 203,Politie naar Apeldoorn,2023-11-01,21:06:51
brandweer,p 2 intrekken alarm brw brandgerucht kazerne gebouw 32 kazernelaan weert,Brandgerucht op Kazernelaan in Weert,2023-11-01,21:23:11
brandweer,p 2 blb-01 brandgerucht kazerne gebouw 32 kazernelaan weert 234431,Brandgerucht op Kazernelaan in Weert,2023-11-01,21:21:35
brandweer,p 2 bob-01 br gerucht afvalstoffendienst treurenburg 's-hertogenbosch 212031,Brandgerucht op Treurenburg in Den Bosch,2023-11-01,21:17:17
brandweer,p 2 bad-01 brandgerucht betreft: oms parkeergarage bezaanjachtplein bezaanjachtplein amsterdam 132131,Brandgerucht op Bezaanjachtplein in Amsterdam,2023-11-01,21:15:05
brandweer,p 2 bmd-01 co-melder meting nieuwe havenweg hilversum 147164,Brandweer met gepaste spoed naar Nieuwe Havenweg in Hilversum,2023-11-01,21:14:33
brandweer,p 2 bnn-02 stank/hind. lucht moseb restaurant kelders leeuwarden 026193 026131,Brandweer met gepaste spoed naar Kelders in Leeuwarden,2023-11-01,21:12:21
brandweer,p 1 intrekken alarm brw oms brandmelding stichting philadelphia zorg eastwei oppenhuizen,Automatisch brandalarm op Eastwei in Oppenhuizen,2023-11-01,21:12:21
brandweer,p 1 bnn-01 oms brandmelding stichting philadelphia zorg eastwei oppenhuizen 025731,Automatisch brandalarm op Eastwei in Oppenhuizen,2023-11-01,21:12:21
brandweer,p 1 bnn-01 br woning kruisweg marum 013493 011131,Woningbrand op Kruisweg in Marum,2023-11-01,21:33:52
brandweer,test melding 2,Brandweer   test/oefening,2023-11-01,21:25:57
brandweer,test 1,Brandweer   test/oefening,2023-11-01,21:25:25
brandweer,p 2 bob-02 liftopsluiting pakeergarage vredeoord grenenhout eindhoven 225045,Assistentie bij liftopsluiting op Vredeoord in Eindhoven,2023-11-01,21:25:18
politie,prio 1 escamplaan platinaweg sgravh ongeval wegvervoer letsel,Ongeval met letsel op Escamplaan in Den Haag,2023-11-01,21:25:24
brandweer,p 3 intrekken alarm brw br gerucht afas software bv - kantoor inspiratielaan leusden,Brandgerucht in Leusden,2023-11-01,21:44:33
brandweer,p 2 br gerucht afas software bv - kantoor inspiratielaan leusden 092231,Brandgerucht in Leusden,2023-11-01,21:43:03
brandweer,p 2 bnh-01 br buiten basisschool de pionier floraronde velserbroek 122430,Buitenbrand op Floraronde in Velserbroek,2023-11-01,21:42:46
brandweer,p 2 bzb-01 co-melder mark oisterwijk 209092 209141,Brandweer met gepaste spoed naar Mark in Oisterwijk,2023-11-01,21:38:50
brandweer,p 2 liftopsluiting pampagras veenendaal 095531,Assistentie bij liftopsluiting op Pampagras in Veenendaal,2023-11-01,21:36:37
politie,graag contact oc apeldoorn gms 254,Politie naar Apeldoorn,2023-11-01,21:43:48
politie,graag tel. contact zcc zwolle,Politie naar Zwolle,2023-11-01,21:36:08
brandweer,"prio 1 toerit a44 li - leiden 8 17,6 d leiden :",Brandweer met spoed naar A44 in Leiden,2023-11-01,21:54:29
brandweer,p 2 bon-01 br gerucht loriestraat kampen 041431,Brandgerucht in Kampen,2023-11-01,21:50:35
brandweer,p 2 br gerucht verkeerscentrum ouderijn papendorpseweg utrecht 094631,Brandgerucht op Papendorpseweg in Utrecht,2023-11-01,21:50:20
brandweer,p 1 bnn-01 br woning kruisweg marum,Woningbrand op Kruisweg in Marum,2023-11-01,21:48:57
brandweer,p 2 brt-02 rookmelder berkelselaan rotterdam 170531,Rookmelder op Berkelselaan in Rotterdam,2023-11-01,21:47:39
brandweer,graag bellen meldkamer ivm middel br br woning schoorsteen c. huygenslaan waddinxveen,"De woningbrand, die naar C. Huygenslaan in Waddinxveen voor woningbrand middelbrand",2023-11-01,21:47:07
brandweer,p 2 bdh-02 middel br br woning schoorsteen c. huygenslaan waddinxveen 162282 169282,Woningbrand op C. Huygenslaan in Waddinxveen,2023-11-01,21:46:29
brandweer,p 1 bnh-02 br buiten kanaalstraat kerkstraat ijmuiden 122430,Buitenbrand op Kanaalstraat in Ijmuiden,2023-11-01,22:12:09
brandweer,"p 2 bon-03 hv overig gaslucht, gaslekkage bogershof velp ge 075341",Gaslucht op Bogershof in Velp,2023-11-01,22:09:03
brandweer,p 2 bon-02 ass. ambu godfried bomansstraat tiel 088532,Brandweer met gepaste spoed naar Godfried Bomansstraat in Tiel,2023-11-01,22:04:33
brandweer,p 2 brt-05 stank/hind. lucht bree rotterdam 173431,Brandweer met gepaste spoed naar Bree in Rotterdam,2023-11-01,22:03:59
brandweer,p 2 brt-04 oms brandmelding ns station t.d.v. rotterdam centraal stationsplein rotterdam 170631,Automatisch brandalarm op Stationsplein in Rotterdam,2023-11-01,22:03:41
brandweer,p 2 brt-03 rookmelder jan van arkelstraat vlaardingen 179233,Rookmelder op Jan van Arkelstraat in Vlaardingen,2023-11-01,22:03:31
brandweer,p 1 bzb-02 reanimatie noordstraat retranchement 196532,Assistentie bij reanimatie op Noordstraat in Retranchement,2023-11-01,22:02:01
brandweer,p 2 bob-01 liftopsluiting van der valk eindhovenseweg-zuid best 225045,Assistentie bij liftopsluiting op Eindhovenseweg-Zuid in Best,2023-11-01,22:00:10
brandweer,u bent niet langer actief in de functie piket_brw_hoofdofficier 2.,Brandweer,2023-11-01,21:58:37
brandweer,u bent nu actief in de functie piket_brw_hoofdofficier 2.,Brandweer,2023-11-01,21:58:37
brandweer,p 2 bon-02 ass. ambu afhijsen godfried bomansstraat tiel 088551,Assistentie ambulance voor afhijsen patiënt op Godfried Bomansstraat in Tiel,2023-11-01,21:57:54
politie,u bent niet langer actief in de functie ovd-p copi piket.,Politie,2023-11-01,22:03:18
brandweer,p 2 stank/hind. lucht bree rotterdam,Brandweer met gepaste spoed naar Bree in Rotterdam,2023-11-01,22:23:52
brandweer,p 1 bon-04 reanimatie oranjeweg rheden 075280,Assistentie bij reanimatie op Oranjeweg in Rheden,2023-11-01,22:23:12
brandweer,p 1 blb-01 reanimatie marktstraat roermond 235169,Assistentie bij reanimatie op Marktstraat in Roermond,2023-11-01,22:21:37
brandweer,"p 2 brt-05 stank/hind. lucht ovd-b, ags bree rotterdam 179021 179194",Brandweer met gepaste spoed naar Bree in Rotterdam,2023-11-01,22:17:52
brandweer,p 1 bnh-02 br buiten kanaalstraat kerkstraat ijmuiden 122462,Buitenbrand op Kanaalstraat in Ijmuiden,2023-11-01,22:13:39
brandweer,"p 2 bon-03 hv overig gaslucht, gaslekkage bogershof velp ge 075096",Gaslucht op Bogershof in Velp,2023-11-01,22:30:54
brandweer,p 1 bnh-03 ass. ambu afhijsen burgemeester postweg landsmeer 133151 113031,Assistentie ambulance voor afhijsen patiënt op Burgemeester Postweg in Landsmeer,2023-11-01,22:28:42
brandweer,p 2 bmd-02 br gerucht betreft: oms de hoven verpleeghuis het ravelijn lelystad 255131,Brandgerucht op Het Ravelijn in Lelystad,2023-11-01,22:44:44
brandweer,p 1 ass. ambu afhijsen prof. abersonlaan utrecht 094852 094831,Assistentie ambulance voor afhijsen patiënt op Prof. Abersonlaan in Utrecht,2023-11-01,22:43:05
brandweer,"p 2 brt-05 stank/hind. lucht ovd-bz ags, ovd-b bree rotterdam",Brandweer met gepaste spoed naar Bree in Rotterdam,2023-11-01,22:43:04
brandweer,prio 4 shell bospoort a4 re leiddp overlast verkeer,Brandweer naar A4,2023-11-01,22:36:31
politie,graag contact caco,Politie,2023-11-01,22:37:19
brandweer,p 1 bob-01 reanimatie inzet aed generaal snijdersstraat helmond 223231,Assistentie bij reanimatie op Generaal Snijdersstraat in Helmond,2023-11-01,22:52:15
brandweer,p 2 bnn-02 stank/hind. lucht de walrus leeuwarden gouverneursplein leeuwarden 026193 026131,Brandweer met gepaste spoed naar Gouverneursplein in Leeuwarden,2023-11-01,22:46:41
politie,"prio 1, vuurpijl waargenomen, mkn1",Politie met spoed,2023-11-01,22:54:58
politie,mdn utr: graag contact met cluster midden,Politie naar Utrecht,2023-11-01,22:49:52
trauma,a1 ambu 08993 - helmond generaal snijderstraat,Traumaheli naar Helmond,2023-11-01,22:53:48
brandweer,p 2 bzb-01 wateroverlast zorgcentrum mariaoord maartenbroersweg hansweert 194232,Wateroverlast op Maartenbroersweg in Hansweert,2023-11-01,23:03:41
brandweer,p 2 bdh-01 co-melder l.v.v.s. augustinus rapenburg leiden 164130,Brandweer met gepaste spoed naar Rapenburg in Leiden,2023-11-01,23:27:44
brandweer,graag telefonisch contact ovdb noord ivm incident leeuwarden.,Brandweer naar Leeuwarden,2023-11-01,23:17:05
brandweer,p 2 brt-01 co-melder katendrechtsestraat rotterdam 173431,Brandweer met gepaste spoed naar Katendrechtsestraat in Rotterdam,2023-11-01,23:17:03
brandweer,p 2 bob-01 wateroverlast binnen technische universiteit ein den dolech eindhoven 222331,Wateroverlast op Den Dolech in Eindhoven,2023-11-01,23:32:22
politie,graag contact oc apeldoorn gms454,Politie naar Apeldoorn,2023-11-01,23:37:08
politie,graag contact oc apeldoorn: gms 477,Politie naar Apeldoorn,2023-11-01,23:33:59
politie,graag contact oc 491,Politie,2023-11-01,23:46:25
politie,1 ongeval wegvervoer letsel kilweg barendrecht icnum 588562,Politie naar Kilweg in Barendrecht voor ongeval met letsel,2023-11-01,23:43:09
trauma,a1 ambu 17992 kilweg barendrecht bardrt bon 153592,Traumaheli naar Kilweg in Barendrecht,2023-11-01,23:44:40
brandweer,p 1 bad-01 br wegvervoer auto halte anderlechtlaan oude haagseweg amsterdam 139233,Voertuigbrand op Anderlechtlaan in Amsterdam,2023-11-02,00:02:58
brandweer,"p 1 401184 letsel a27 li 31,5 nieuwendijk",Ongeval met letsel op A27 in Nieuwendijk,2023-11-02,00:00:02
brandweer,p 1 bon-01 br gezondheidszorg pro persona wolfheze wolfheze,Brandmelding op Wolfheze in Wolfheze,2023-11-01,23:54:27
brandweer,p 1 bon-01 br gezondheidszorg pro persona wolfheze wolfheze,Brandmelding op Wolfheze in Wolfheze,2023-11-01,23:54:27
brandweer,graag telefonisch contact rac,Brandweer  voor contact met meldkamer,2023-11-01,23:51:27
brandweer,p 2 brt-02 liftopsluiting aafje hoppesteyn crooswijk boezemsingel rotterdam 170931,Assistentie bij liftopsluiting op Boezemsingel in Rotterdam,2023-11-02,00:17:07
brandweer,p 2 bnh-01 oms brandmelding 't behouden huys 1 willem barentszstraat den helder 104432,Automatisch brandalarm op Willem Barentszstraat in Den Helder,2023-11-02,00:08:56
politie,"mdn utr: goedenacht, verzoek contact ovd-oc.",Politie naar Utrecht,2023-11-02,00:09:33
brandweer,p 2 bnn-02 stank/hind. lucht boe de walrus leeuwarden gouverneursplein leeuwarden 026121 026182,Brandweer met gepaste spoed naar Gouverneursplein in Leeuwarden,2023-11-02,00:27:22
brandweer,p 1 persoon te water jacob van lennepkade amsterdam,Persoon te water op Jacob van Lennepkade in Amsterdam,2023-11-02,00:25:35
brandweer,p 1 bad-02 persoon te water jacob van lennepkade amsterdam 133111 139091 133331,Persoon te water op Jacob van Lennepkade in Amsterdam,2023-11-02,00:23:50
trauma,a1 13991 13163 13121 jacob van lennepkade amsterdam 98356 98357 98358,Traumaheli naar Jacob van Lennepkade in Amsterdam,2023-11-02,00:25:35
brandweer,p 2 bnh-01 co-melder assinkbos hoofddorp 124230,Brandweer met spoed naar Assinkbos in Hoofddorp,2023-11-02,00:40:08
brandweer,p 2 brt-03 co-melder burgemeester le fevre de montignylaan rotterdam 171031,Brandweer met gepaste spoed naar Burgemeester Le Fèvre de Montignylaan in Rotterdam,2023-11-02,00:30:50
brandweer,p 2 bad-03 ass. ambu tilassistentie dijkgraafplein amsterdam 139232,Assistentie ambulance op Dijkgraafplein in Amsterdam,2023-11-02,00:49:01
brandweer,p 2 bon-04 ass. ambu afhijsen industriestraat hengelo 051151,Assistentie ambulance voor afhijsen patiënt op Industriestraat in Hengelo,2023-11-02,01:19:14
brandweer,p 2 bzb-01 oms brandmelding hotel het raedthuys opvanglocatie markt sint-maartensdijk 192234,Automatisch brandalarm op Markt in Sint-Maartensdijk,2023-11-02,01:06:28
brandweer,p 2 bad-03 ass. ambu dijkgraafplein amsterdam 132651,Brandweer met gepaste spoed naar Dijkgraafplein in Amsterdam,2023-11-02,01:03:31
