Discipline,Titel,Beschrijving,Publicatiedatum,Publicatietijd
brandweer,p 2 bnh-05 ass. ambu hogerlust middenbeemster 115031,Brandweer met gepaste spoed naar Hogerlust in Middenbeemster,2023-11-01,10:33:16
brandweer,p 1 oms br beheerssyst. dc miles maarsen industrieweg maarssen 093931,Automatisch brandalarm op Industrieweg in Maarssen,2023-11-01,10:33:05
brandweer,p 2 bnh-05 ass. ambu afhijsen hogerlust middenbeemster 118051 111031,Assistentie ambulance voor afhijsen patiënt op Hogerlust in Middenbeemster,2023-11-01,10:31:07
brandweer,p 2 brt-02 dier te water hollandseweg oudenhoorn 173031,Dier te water op Hollandseweg in Oudenhoorn,2023-11-01,10:26:12
politie,ongeval/wegvervoer/letsel prio 1 ryptsjerk rijksstraatweg,Ongeval met letsel op Rijksstraatweg in Ryptsjerk,2023-11-01,10:31:14
politie,ongeval/wegvervoer/letsel prio 1 groningen friesestraatweg,Ongeval met letsel op Friesestraatweg in Groningen,2023-11-01,10:29:31
politie,"ongeval/wegvervoer/letsel prio 1 heerenveen a7 li 142,3 c",Ongeval met letsel op A7 in Heerenveen,2023-11-01,10:27:44
trauma,a1 ambu 08993 - best vleutstraat rit 285101,Traumaheli naar Vleutstraat in Best,2023-11-01,10:28:07
brandweer,p 2 bmd-01 br nacontrole splijtbakweg almere 254132,Nacontrole op Splijtbakweg in Almere,2023-11-01,10:44:44
brandweer,p 1 bad-02 ass. politie deur openen ceintuurbaan amsterdam 133231,Brandweer met spoed naar Ceintuurbaan in Amsterdam  assistentie politie,2023-11-01,10:39:57
brandweer,p 1 ongeval wegvervoer letsel hendrikje stoffelsstraat amsterdam,Ongeval met letsel op Hendrikje Stoffelsstraat in Amsterdam,2023-11-01,10:39:26
brandweer,p 2 bzb-02 dier te water engelsestoof wijk en aalburg 205132,Dier te water op Engelsestoof in Wijk En Aalburg,2023-11-01,10:37:22
brandweer,contact mkb-nh middenbeemster,Brandweer naar Middenbeemster,2023-11-01,10:35:50
brandweer,p 3 intrekken alarm brw oms br beheerssyst. dc miles maarsen industrieweg maarssen,Automatisch brandalarm op Industrieweg in Maarssen,2023-11-01,10:35:33
brandweer,p 1 br woning noordweg zeist 096631,Woningbrand op Noordweg in Zeist,2023-11-01,10:35:10
brandweer,p 1 oms br beheerssyst. dc miles maarsen industrieweg maarssen 094431,Geen beschrijving beschikbaar,2023-11-01,10:34:26
politie,ongeval/wegvervoer/letsel prio 1 emmen hondsrugweg noordbargerstraat,Ongeval met letsel op Hondsrugweg in Emmen,2023-11-01,10:44:05
brandweer,p 1 bnn-02 ongeval gaslekkage buiten marijkelaan baflo 013493 011531,Geen beschrijving beschikbaar,2023-11-01,10:55:48
brandweer,p 2 brt-03 br container van beethovenlaan capelle aan den ijssel 171131,Buitenbrand (container) op Van Beethovenlaan in Capelle Aan Den Ijssel,2023-11-01,10:52:03
brandweer,"p 1 bad-02 ass. politie afhijsen, deur openen ceintuurbaan amsterdam 133251",Assistentie ambulance voor afhijsen patiënt op Ceintuurbaan in Amsterdam,2023-11-01,10:49:56
brandweer,p 1 bnh-01 br woning elemastraat nieuw-vennep 124530,Woningbrand op Elemastraat in Nieuw-Vennep,2023-11-01,11:17:49
brandweer,p 1 bnh-01 br woning elemastraat nieuw-vennep 121221 124330 161030,Woningbrand op Elemastraat in Nieuw-Vennep,2023-11-01,11:17:49
brandweer,p 2 bon-01 rookmelder louisa annahof lienden 087431,Rookmelder op Louisa Annahof in Lienden,2023-11-01,11:15:44
brandweer,p 1 bad-05 ass. ambu deur openen loggerhof amsterdam 132131,Brandweer met spoed naar Loggerhof in Amsterdam,2023-11-01,11:14:48
brandweer,p 1 bnn-02 middel hv ongeval gaslekkage buiten ags marijkelaan baflo,Gaslek op Marijkelaan in Baflo,2023-11-01,11:14:33
brandweer,p 2 bob-03 dienstverlening gaslucht buiten rozenstraat raadhuisstraat rosmalen 212432,Gaslucht op Rozenstraat in Rosmalen,2023-11-01,11:13:28
brandweer,p 1 bnn-02 middel hv ongeval gaslekkage buiten marijkelaan baflo 011532,Gaslek op Marijkelaan in Baflo,2023-11-01,11:10:43
brandweer,p 1 bnh-06 oms handmelder nw ziekenhuis hoofdpaneel a receptie wilhelminalaan alkmaar 104131,Automatisch brandalarm (handmelder) op Wilhelminalaan in Alkmaar,2023-11-01,11:10:31
brandweer,graag telefonisch contact rac,Brandweer  voor contact met meldkamer,2023-11-01,11:09:09
brandweer,p 2 bad-04 stank/hind. lucht gaslucht binnen linnaeusstraat amsterdam 133431,Gaslucht op Linnaeusstraat in Amsterdam,2023-11-01,11:08:03
brandweer,p 2 bdh-03 ass. ambu afhijsen bieremalaan 's-gravenhage 155550 155630,Assistentie ambulance voor afhijsen patiënt op Bieremalaan in Den Haag,2023-11-01,11:05:44
brandweer,"prio 4 a20 li 46,8 moordr loslopende dieren op weg",Brandweer naar A20 in Moordrecht,2023-11-01,10:56:33
politie,ongeval wegvervoer letsel sprongsewegpk rijkevoort,Politie naar Sprongseweg in Rijkevoort voor ongeval met letsel,2023-11-01,11:18:26
politie,ongeval wegvervoer letsel mecklenburgstraatpz eindhoven,Politie naar Mecklenburgstraat in Eindhoven voor ongeval met letsel,2023-11-01,11:01:50
politie,prio 1 koningin marialaan bezuidenhoutseweg sgravh ongeval wegvervoer letsel,Ongeval met letsel op Koningin Marialaan in Den Haag,2023-11-01,10:57:22
politie,prio 1 koningin marialaan sgravh ongeval wegvervoer letsel,Ongeval met letsel op Koningin Marialaan in Den Haag,2023-11-01,10:57:14
trauma,a1 ambu 08993 - paleisweg garderen rit 285150 glm,Traumaheli naar Paleisweg in Garderen,2023-11-01,11:06:12
brandweer,p 1 bdh-02 testmelding kazerne scheveningen sloepstraat 's-gravenhage 157130,Brandweer met spoed naar Sloepstraat in Den Haag  test/oefening,2023-11-01,11:28:49
brandweer,p 2 bon-02 ass. ambu afhijsen rijnstraat apeldoorn 062651 063331,Assistentie ambulance voor afhijsen patiënt op Rijnstraat in Apeldoorn,2023-11-01,11:27:20
brandweer,p 1 bad-01 br woning schoorsteen hornweg aalsmeer 123150 135231 135232,Woningbrand op Schoorsteen in Aalsmeer,2023-11-01,11:24:33
brandweer,p 2 bdh-01 rookmelder meidoornstraat 's-gravenhage 157830,Rookmelder op Meidoornstraat in Den Haag,2023-11-01,11:21:24
politie,aanrijding letsel nassaustraat sint hubertusweg erlecom 686842,Politie naar Sint Hubertusweg in Erlecom voor ongeval met letsel,2023-11-01,11:26:47
politie,aanrijding letsel burgemeester matsersingel rotterdamsingel arnhem 686828,Politie naar Burgemeester Matsersingel in Arnhem voor ongeval met letsel,2023-11-01,11:25:18
politie,ongeval/wegvervoer/letsel prio 1 emmen nieuw-amsterdamsestraat brinkenweg,Ongeval met letsel op Nieuw-Amsterdamsestraat in Emmen,2023-11-01,11:20:25
trauma,a1 dia: ja ambu 17992 kloosplantsoensc ridderkerk riddkk bon 153215,Traumaheli naar Kloosplantsoen in Ridderkerk,2023-11-01,11:20:09
brandweer,p 2 bdh-02 ass. ambu afhijsen ghanastraat delft 155550 155530,Assistentie ambulance voor afhijsen patiënt op Ghanastraat in Delft,2023-11-01,11:39:52
brandweer,"p 2 bad-05 kleine hv ass. ambu afhijsen, deur openen loggerhof amsterdam 133151",Assistentie ambulance voor afhijsen patiënt op Loggerhof in Amsterdam,2023-11-01,11:37:37
brandweer,p 1 bad-01 middel br br woning schoorsteen hornweg aalsmeer 139093,Woningbrand op Schoorsteen in Aalsmeer,2023-11-01,11:35:29
brandweer,graag tel. contact mkb,Brandweer,2023-11-01,11:33:12
brandweer,p 2 bad-03 ass. ambu afhijsen baetostraat amsterdam 139251 132431,Assistentie ambulance voor afhijsen patiënt op Baetostraat in Amsterdam,2023-11-01,11:33:09
politie,2 ongeval wegvervoer letsel stationsweg gorinchem icnum 587307,Politie naar Stationsweg in Gorinchem voor ongeval met letsel,2023-11-01,11:34:20
brandweer,p 1 bnh-01 middel br br woning elemastraat nieuw-vennep 121201,Woningbrand op Elemastraat in Nieuw-Vennep,2023-11-01,11:50:18
brandweer,p 2 bnh-03 ass. ambu afhijsen violierweg landsmeer 118052 113031,Assistentie ambulance voor afhijsen patiënt op Violierweg in Landsmeer,2023-11-01,11:49:27
brandweer,p 2 bad-01 middel br br woning schoorsteen betreft: rookventilator hornweg aalsmeer 135281,Woningbrand op Schoorsteen in Aalsmeer,2023-11-01,11:46:20
brandweer,p 2 bon-03 ass. pol n785 - schelmseweg rozendaal 073631,Brandweer met gepaste spoed naar Schelmseweg in Rozendaal,2023-11-01,11:45:48
brandweer,p 2 bon-03 ass. pol n785 - schelmseweg rozendaal 075341,Brandweer met gepaste spoed naar Schelmseweg in Rozendaal,2023-11-01,11:43:50
brandweer,contact mkb-nh ac-b 121296,Brandweer,2023-11-01,11:43:40
brandweer,p 2 bnh-02 contact mkb ac-b veiligheidsregio nhn hertog aalbrechtweg alkmaar 106690,Brandweer met gepaste spoed naar Hertog Aalbrechtweg in Alkmaar,2023-11-01,11:42:33
brandweer,p 1 400242 letsel cirkel vlissingen,Ongeval met letsel op Cirkel in Vlissingen,2023-11-01,11:42:24
politie,aanrijding letsel hoogzand oostrum li,Politie  voor ongeval met letsel,2023-11-01,11:47:52
brandweer,p 2 blb-01 dier in problemen via raeka weert 234131,Dier in problemen in Weert,2023-11-01,12:04:53
brandweer,gezocht pager,Brandweer,2023-11-01,12:01:27
brandweer,p 2 bnh-03 ass. ambu violierweg landsmeer 118034,Brandweer met gepaste spoed naar Violierweg in Landsmeer,2023-11-01,11:58:23
brandweer,p 1 bnn-01 oms brandmelding abe lenstra zuidtribune abe lenstra boulevard heerenveen 026432,Automatisch brandalarm op Abe Lenstra boulevard in Heerenveen,2023-11-01,11:55:37
politie,aanrijding letsel julianaschool de stroekeld rijssen 686948,Politie naar De Stroekeld in Rijssen voor ongeval met letsel,2023-11-01,12:03:35
politie,aanrijding letsel julianaschool de stroekeld rijssen 686950,Politie naar De Stroekeld in Rijssen voor ongeval met letsel,2023-11-01,12:03:35
politie,aanrijding letsel bevrijdingsweg venlo,Politie naar Bevrijdingsweg in Venlo voor ongeval met letsel,2023-11-01,11:55:43
brandweer,p 2 bad-08 brandgerucht betreft: oms olvg locatie west jan tooropstraat amsterdam 132431,Brandgerucht op Jan Tooropstraat in Amsterdam,2023-11-01,12:16:13
brandweer,p 2 brt-04 buitensluiting middin boergoensestraat rotterdam 173431,Brandweer met gepaste spoed naar Boergoensestraat in Rotterdam,2023-11-01,12:15:31
brandweer,p 2 bad-07 brandgerucht betreft: oms hourglass amsterdam parnassusweg amsterdam 133231,Brandgerucht op Parnassusweg in Amsterdam,2023-11-01,12:08:31
brandweer,p 1 bad-06 reanimatie gieterij amsterdam 133131,Assistentie bij reanimatie op Gieterij in Amsterdam,2023-11-01,12:07:33
politie,"aanrijding letsel n342 li - provinciale rondweg 57,1 oldenzaal 686980",Politie naar N342 in Oldenzaal voor ongeval met letsel,2023-11-01,12:15:08
politie,prio 1 n455 - hoogeveenseweg boskp ongeval wegvervoer letsel,Ongeval met letsel op Hoogeveenseweg in Boskoop,2023-11-01,12:11:07
politie,2 ongeval wegvervoer materieel hofplein rotterdam icnum 587372,Politie naar Hofplein in Rotterdam voor Ongeval Wegvervoer Materieel,2023-11-01,12:10:24
brandweer,spoedambu,Geen beschrijving beschikbaar,2023-11-01,12:30:14
brandweer,p 1 bnn-03 br wegvervoer auto de draei heeg 025632,Geen beschrijving beschikbaar,2023-11-01,12:28:23
brandweer,p 2 bdh-03 stormschade onyxhorst 's-gravenhage 159630,Geen beschrijving beschikbaar,2023-11-01,12:28:07
brandweer,graag contact mkon.,Brandweer,2023-11-01,12:21:12
brandweer,p 1 bdh-01 oms brandmelding world europol garage johan de wittlaan 's-gravenhage 157130,Automatisch brandalarm op Johan de Wittlaan in Den Haag,2023-11-01,12:21:07
politie,aanrijding letsel looierstraat gulpen,Politie naar Looierstraat in Gulpen voor ongeval met letsel,2023-11-01,12:24:07
politie,"aanrijding letsel n229 - graaf van lynden van sandenburgweg,1 cothen",Politie naar Graaf van Lynden van Sandenburgweg in Cothen voor ongeval met letsel,2023-11-01,12:21:35
trauma,a1 13991 kuyperlaan 1412 naarden 98160 regio 14,Geen beschrijving beschikbaar,2023-11-01,12:29:01
brandweer,p 1 bnh-04 buitensluiting kolonelsdiep zaandam 118052,Geen beschrijving beschikbaar,2023-11-01,12:37:50
brandweer,p 1 bnn-04 br bijgebouw brikstraat harlingen 027393 024631,Brand in bijgebouw op Brikstraat in Harlingen,2023-11-01,12:35:22
brandweer,p 1 bnh-04 buitensluiting kolonelsdiep zaandam 118034,Brandweer met spoed naar Kolonelsdiep in Zaandam,2023-11-01,12:34:35
brandweer,p 2 bdh-05 co-melder middelstegracht leiden 164130,Brandweer met gepaste spoed naar Middelstegracht in Leiden,2023-11-01,12:34:10
brandweer,p 1 bmd-01 hv overig gaslekkage binnen j.t.p. bijhouwerstraat almere 254091 254132 254133,Gaslek op J.T.P. Bijhouwerstraat in Almere,2023-11-01,12:34:02
politie,prio 1 plesmanlaan ehrenfestweg leiden ongeval wegvervoer letsel,Ongeval met letsel op Plesmanlaan in Leiden,2023-11-01,12:36:05
trauma,a1 ambu 08993 - alkmaar duivelandstraat rit 285273,Traumaheli naar Duivelandstraat in Alkmaar,2023-11-01,12:36:08
trauma,a1 ambu 17992 johan frisostraathj zoeterwoude zoetwd bon 153263,Traumaheli naar Johan Frisostraat in Zoeterwoude,2023-11-01,12:30:26
brandweer,p 2 bdh-04 brandgerucht julialaantje rijswijk zh 157630 159660,Geen beschrijving beschikbaar,2023-11-01,12:48:39
brandweer,p 3 brt-07 geplande actie hovd-b wilhelminakade telefoonstoring stedin rotterdam 179091,Brandweer zonder spoed naar Wilhelminakade in Rotterdam,2023-11-01,12:48:37
brandweer,p 1 brt-05 oms handmelder hotel het spui havendam rhoon 173231,Automatisch brandalarm (handmelder) op Havendam in Rhoon,2023-11-01,12:46:07
brandweer,p 1 400334 letsel bredaseweg etten-leur,Ongeval met letsel op Bredaseweg in Etten-Leur,2023-11-01,12:44:41
brandweer,p 1 brt-01 stank/hind. lucht gaslucht binnen stationsstraat vlaardingen 179233 179191,Gaslucht op Stationsstraat in Vlaardingen,2023-11-01,12:44:20
brandweer,u bent niet langer actief in de functie piket_brw_hoofdofficier 1.,Brandweer,2023-11-01,12:42:52
brandweer,u bent nu actief in de functie piket_brw_hoofdofficier 1.,Brandweer,2023-11-01,12:42:52
brandweer,p 2 blb-01 dier in problemen via raeka weert 234111,Dier in problemen in Weert,2023-11-01,12:41:48
politie,1 ongeval wegvervoer letsel gordelweg rotterdam icnum 587440,Politie naar Gordelweg in Rotterdam voor ongeval met letsel,2023-11-01,12:48:05
politie,1 ongeval wegvervoer letsel oostplein rotterdam icnum 587439,Politie naar Oostplein in Rotterdam voor ongeval met letsel,2023-11-01,12:47:17
politie,1 ongeval wegvervoer letsel dantestraat rotterdam icnum 587434,Geen beschrijving beschikbaar,2023-11-01,12:44:00
politie,graag contact meldkamer politie ivm gms 959,Politie,2023-11-01,12:42:42
politie,prio 1 kamperfoeliestraat sgravh ongeval wegvervoer letsel,Ongeval met letsel op Kamperfoeliestraat in Den Haag,2023-11-01,12:39:46
trauma,a1 dia 13991 duivelandstraat alkmaar 98165 regio 10,Traumaheli naar Duivelandstraat in Alkmaar,2023-11-01,12:41:37
brandweer,svp telefonisch contact mkob,Brandweer,2023-11-01,13:08:23
brandweer,p 1 bnh-20 oms brandmelding terminal 1 rinse hofstraweg schiphol 129230,Automatisch brandalarm op Rinse Hofstraweg in Schiphol,2023-11-01,13:08:03
brandweer,p 2 let op oefening!! bad-01 br industrie eurotank terminals amsterdam van riebeeckhavenweg amsterdam 138861 138831,Brandweer met gepaste spoed naar Van Riebeeckhavenweg in Amsterdam  dit betreft een oefening,2023-11-01,13:07:05
brandweer,p 1 bdh-03 ass. ambu regentesselaan 's-gravenhage 157830,Brandweer met spoed naar Regentesselaan in Den Haag,2023-11-01,13:05:42
brandweer,p 2 intrekken alarm brw br gerucht distributiecentrum plus keltenweg oss,Brandgerucht op Keltenweg in Oss,2023-11-01,13:02:35
brandweer,p 1 400353 letsel markt etten-leur,Ongeval met letsel op Markt in Etten-Leur,2023-11-01,13:01:18
brandweer,p 1 bdh-02 ongeval gaslekkage binnen vinkenlaan delft 155550 155530 159591,Gaslek op Vinkenlaan in Delft,2023-11-01,13:00:26
brandweer,p 2 bon-04 ass. ambu tilassistentie brullenweide westervoort 073631,Assistentie ambulance op Brullenweide in Westervoort,2023-11-01,12:59:22
brandweer,p 2 bob-01 br gerucht distributiecentrum plus keltenweg oss 212741,Brandgerucht op Keltenweg in Oss,2023-11-01,12:58:33
brandweer,p 2 bon-02 liftopsluiting veldhoflanden enschede 054131,Assistentie bij liftopsluiting op Veldhoflanden in Enschede,2023-11-01,12:55:35
brandweer,p 2 brt-07 brandgerucht schinkelse baan capelle aan den ijssel 171031,Brandgerucht op Schinkelse Baan in Capelle Aan Den Ijssel,2023-11-01,12:53:58
brandweer,u bent niet langer actief in de functie ac-bz piket.,Brandweer,2023-11-01,12:50:52
brandweer,u bent nu actief in de functie ac-bz piket.,Brandweer,2023-11-01,12:50:50
brandweer,p 1 bon-01 oms brandmelding voorthuis woonzorgcentrum het goudkamp voorthuizen 071441,Automatisch brandalarm in Voorthuizen,2023-11-01,12:50:16
politie,1 ongeval wegvervoer letsel spinozaweg rotterdam icnum 587478,Politie naar Spinozaweg in Rotterdam voor ongeval met letsel,2023-11-01,13:06:39
politie,graag contact oc apeldoorn gms 959,Geen beschrijving beschikbaar,2023-11-01,12:53:01
trauma,a1 13991 13105 monnetflat uithoorn 98174 98175,Traumaheli naar Monnetflat in Uithoorn,2023-11-01,13:05:25
trauma,a1 dia: ja ambu 17992 trompstraatjw zoetermeer zoetmr bon 153284,Traumaheli naar Trompstraat in Zoetermeer,2023-11-01,12:53:50
brandweer,p 1 bdh-05 br woning okkernootstraat 's-gravenhage 157750 159631 157830 159592,Woningbrand op Okkernootstraat in Den Haag,2023-11-01,13:43:22
brandweer,p 1 bzb-02 br woning schoorsteen jan karsstraat oostburg 196530 196550,Woningbrand op Jan Karsstraat in Oostburg,2023-11-01,13:42:28
brandweer,p 1 bdh-04 oms brandmelding world europol garage johan de wittlaan 's-gravenhage 157230,Automatisch brandalarm op Johan de Wittlaan in Den Haag,2023-11-01,13:42:14
brandweer,p 2 stormschade autoweg rhenen 098052,Stormschade op Autoweg in Rhenen,2023-11-01,13:41:05
brandweer,p 1 blb-03 ongeval wegvervoer heerstraat noord stein 243371 243591 244531,Ongeval op Heerstraat Noord in Stein,2023-11-01,13:40:49
brandweer,p 1 400401 ongeval water oosterhoutseweg teteringen,Waterongeval op Oosterhoutseweg in Teteringen,2023-11-01,13:38:30
brandweer,"p 1 blb-02 br wegvervoer auto n300 re - ring parkstad 14,8 landgraaf 243891 244241 244441",Voertuigbrand op N300 in Landgraaf,2023-11-01,13:37:27
brandweer,p 2 brt-06 ongeval obs de plevier plevier hoogvliet rotterdam 172231,Ongeval op Plevier in Hoogvliet Rotterdam,2023-11-01,13:34:20
brandweer,graag contact caco gmk den haag,Brandweer naar Den Haag,2023-11-01,13:32:57
brandweer,p 2 bzb-01 oms brandmelding juvent prinses maximastraat middelburg 194530,Automatisch brandalarm op Prinses Maximastraat in Middelburg,2023-11-01,13:30:24
brandweer,prio 1 afrit a4 re - den hoorn 13 schild ongeval letsel,Ongeval met letsel op A4,2023-11-01,13:27:48
brandweer,p 2 bnn-03 brandgerucht friesland campina verlaatsterweg gerkesklooster 024531,Brandgerucht op Verlaatsterweg in Gerkesklooster,2023-11-01,13:26:54
brandweer,p 2 bad-02 ass. ambu weegbreestraat amsterdam 133131,Brandweer met gepaste spoed naar Weegbreestraat in Amsterdam,2023-11-01,13:26:41
brandweer,spoedambu,Brandweer,2023-11-01,13:25:14
brandweer,p 2 bad-02 ass. ambu afhijsen weegbreestraat amsterdam 133151 132131,Assistentie ambulance voor afhijsen patiënt op Weegbreestraat in Amsterdam,2023-11-01,13:24:37
brandweer,gaarne contact mkb,Brandweer,2023-11-01,13:22:48
brandweer,p 1 brt-02 oms handmelder stadklooster dordt vriesestraat dordrecht 186532,Automatisch brandalarm (handmelder) op Vriesestraat in Dordrecht,2023-11-01,13:13:46
politie,aanrijding letsel heerstraat noord stein,Politie naar Heerstraat Noord in Stein voor ongeval met letsel,2023-11-01,13:40:49
politie,aanrijding letsel intratuin schuilenburgsingel almelo 687147,Geen beschrijving beschikbaar,2023-11-01,13:28:05
politie,graag contact oc apeldoorn nr:132,Politie naar Apeldoorn,2023-11-01,13:21:33
politie,aanrijding letsel europaplein deventer 687119,Politie naar Deventer voor ongeval met letsel,2023-11-01,13:20:02
politie,svp contact mka,Politie  voor contact met de meldkamer opnemen,2023-11-01,13:13:25
brandweer,p 1 brt-01 br woning van beethovenlaan maassluis 170251 170231 170232,Woningbrand op Van Beethovenlaan in Maassluis,2023-11-01,13:52:26
brandweer,"prio 4 a4 li 59,0 schild eigen initiatief",Brandweer naar A4 in Schipluiden,2023-11-01,13:52:08
brandweer,p 2 contact mkb bvd hoofdkantoor vrzw prins bernhardplein zaandam,Brandweer met gepaste spoed naar Prins Bernhardplein in Zaandam,2023-11-01,13:45:42
politie,aanrijding letsel koninginnelaan apeldoorn 687172,Politie naar Koninginnelaan in Apeldoorn voor ongeval met letsel,2023-11-01,13:54:10
politie,ongeval/wegvervoer/letsel prio 1 groningen duinkerkenbrug winschoterweg,Ongeval met letsel op Winschoterweg in Groningen,2023-11-01,13:50:59
politie,contact ovd-oc svp,Politie,2023-11-01,13:50:20
politie,ongeval wegvervoer letsel keukenconcurrent engelsewegak helmond,Politie naar Engelseweg in Helmond voor ongeval met letsel,2023-11-01,13:46:08
brandweer,p 2 bon-02 br nacontrole de veste doesburg 075431,Nacontrole op De Veste in Doesburg,2023-11-01,14:16:26
brandweer,p 2 bon-02 br nacontrole de veste doesburg 075731,Nacontrole op De Veste in Doesburg,2023-11-01,14:14:44
brandweer,p 2 bnh-02 ass. ambu zwarteweg zandvoort 12zvt,Brandweer met gepaste spoed naar Zandvoort,2023-11-01,14:12:55
brandweer,p 1 ongeval wegvervoer letsel kazernepad amstelveen,Ongeval met letsel in Amstelveen,2023-11-01,14:12:52
brandweer,graag hefbrug waddinxveen vrij houden,Brandweer naar Waddinxveen,2023-11-01,14:12:33
brandweer,graag hefbrug boskoop vrij houden,Brandweer naar Boskoop,2023-11-01,14:12:12
brandweer,p 1 bdh-06 br woning schoorsteen c. huygenslaan waddinxveen 163152 169194 162260 163830 163131,Woningbrand op C. Huygenslaan in Waddinxveen,2023-11-01,14:12:11
brandweer,p 1 ongeval wegvervoer letsel plesmanlaan amsterdam,Ongeval met letsel op Plesmanlaan in Amsterdam,2023-11-01,14:12:01
brandweer,p 2 brt-01 br woning ovd-b van beethovenlaan maassluis 179191,Geen beschrijving beschikbaar,2023-11-01,14:11:39
brandweer,p 2 weeralarm wind weercode geel regio zuid limburg maastricht,Brandweer met gepaste spoed naar Maastricht,2023-11-01,14:11:07
brandweer,p 2 weeralarm weercode geel wind regio limburg noord venlo,Brandweer met gepaste spoed naar Venlo,2023-11-01,14:10:55
brandweer,p 3 bnh-13 oefening br scheepvaart basisweg velsen-noord 122340 122430,Scheepvaartbrand op Basisweg in Velsen-Noord,2023-11-01,14:10:14
brandweer,p 1 bdh-03 oms brandmelding parnassia loc. monsterseweg monsterseweg 's-gravenhage 156730,Automatisch brandalarm op Monsterseweg in Den Haag,2023-11-01,14:07:57
brandweer,p 2 bob-01 dienstverlening gaslucht binnen elbestraat veghel 213931,Gaslucht op Elbestraat in Veghel,2023-11-01,14:06:59
brandweer,p 1 400443 letsel professor cobbenhagenlaan tilburg,Ongeval met letsel op Professor Cobbenhagenlaan in Tilburg,2023-11-01,14:06:21
brandweer,p 2 brt-02 liftopsluiting cargadoorskade rotterdam 173431,Assistentie bij liftopsluiting op Cargadoorskade in Rotterdam,2023-11-01,14:04:18
brandweer,svp contact meldkamer brandweer ongeval wegvervoer ovd-bz heerstraat noord stein,Brandweer naar Heerstraat Noord in Stein voor ongeval,2023-11-01,14:03:54
brandweer,p 1 bon-01 br bijgebouw keet/hok/schuurtje johannes bosboomstraat deventer 042830,Brand in bijgebouw op Johannes Bosboomstraat in Deventer,2023-11-01,14:00:18
brandweer,p 2 bdh-01 co-melder burgemeester van wichenlaan oude wetering 162031,Brandweer met gepaste spoed naar Burgemeester van Wichenlaan in Oude Wetering,2023-11-01,14:00:14
politie,graag contact opco oc,Politie,2023-11-01,14:18:05
politie,"ongeval/wegvervoer/letsel prio 1 wijnaldum a31 re - waadseewei 19,5",Ongeval met letsel op A31 in Wijnaldum,2023-11-01,14:16:54
politie,graag contact oc gms230,Politie,2023-11-01,14:08:25
trauma,a1 dia 13991 boy edgarlaan beverwijk 98191 regio 12,Traumaheli naar Boy Edgarlaan in Beverwijk,2023-11-01,14:03:33
brandweer,p 1 bon-03 br woning revelingseweg wapenveld 061341,Geen beschrijving beschikbaar,2023-11-01,14:32:24
brandweer,p 2 bdh-04 stank/hind. lucht binnen pinterzijde zoetermeer 155330,Brandweer met gepaste spoed naar Pinterzijde in Zoetermeer,2023-11-01,14:31:11
brandweer,p 1 bmd-01 persoon te water vreelandseweg nederhorst den berg 142811 091311 142091 142832 142631,Geen beschrijving beschikbaar,2023-11-01,14:30:34
brandweer,p 2 brt-03 liftopsluiting stn gorinchem spoor 1 821 gorinchem 188131,Assistentie bij liftopsluiting in Gorinchem,2023-11-01,14:30:25
brandweer,p 1 brt-02 br woning hollandsestraat ridderkerk 173751 173831 170331,Woningbrand op Hollandsestraat in Ridderkerk,2023-11-01,14:25:52
brandweer,p 1 bon-01 br bijgebouw tbo keet/hok/schuurtje johannes bosboomstraat deventer 041000,Brand in bijgebouw op Johannes Bosboomstraat in Deventer,2023-11-01,14:23:57
brandweer,p 2 bdh-02 oms brandmelding berkhout berkhoutlaan lisse 161130,Automatisch brandalarm op Berkhoutlaan in Lisse,2023-11-01,14:22:24
brandweer,intrekken alarm brw br nacontrole de veste doesburg 075431,Nacontrole op De Veste in Doesburg,2023-11-01,14:21:44
politie,persoon te water vreelandseweg nederhorst den berg,Politie naar Vreelandseweg in Nederhorst Den Berg voor Persoon te water,2023-11-01,14:30:22
politie,ongeval wegvervoer letsel oirschotsedijk eindhoven,Politie naar Oirschotsedijk in Eindhoven voor ongeval met letsel,2023-11-01,14:23:05
trauma,a1 13991 diependaalselaan 1215 hilversum 98197 / regio 14,Geen beschrijving beschikbaar,2023-11-01,14:21:54
trauma,a1 13991 diependaalselaan hilversum 98197,Traumaheli naar Diependaalselaan in Hilversum,2023-11-01,14:21:40
brandweer,p 1 bzb-01 reanimatie jacob van lennepstraat terneuzen 196650,Assistentie bij reanimatie op Jacob van Lennepstraat in Terneuzen,2023-11-01,14:41:44
brandweer,p 2 br gerucht diakonessenhuis utrecht bouwdeel q bosboomstraat utrecht 094631,Geen beschrijving beschikbaar,2023-11-01,14:40:09
brandweer,p 1 bnh-02 ass. ambu afhijsen leliestraat volendam 118051 112031,Geen beschrijving beschikbaar,2023-11-01,14:37:14
brandweer,p 1 ongeval wegvervoer letsel burgemeester roellstraat amsterdam,Ongeval met letsel op Burgemeester Röellstraat in Amsterdam,2023-11-01,14:37:10
brandweer,intrekken alarm brw br woning revelingseweg wapenveld,Woningbrand op Revelingseweg in Wapenveld,2023-11-01,14:34:53
